{
 "rnpbench_evaluate_version": "0.2.0.dev1",
 "created_utc": "2026-10-13T20:05:22+00:00",
 "target_id": "7K9D",
 "input": {
  "prediction": {
   "path": "/tmp/RNPLens_example_clone/examples/reference_based/7K9D_prediction.pdb",
   "sha256": "9c1a6659f60fa28011b4deae449524146aaba822529e2f065a541b0d1a968009",
   "engine": "Boltz-2",
   "designated_output": {
    "rule": "engine rank-0 output (Boltz-2 model_0)",
    "sample_index": 0
   }
  },
  "reference": {
   "path": "/tmp/RNPLens_example_clone/examples/reference_based/7K9D_reference.cif",
   "sha256": "75fa157147f8e721244095aa7141e8c90898d25296d222eae7898f9b10b6ca8e"
  },
  "construct": {
   "protein_length": 98,
   "rna_length": 60,
   "protein_sequence": "GPSPEIGQIVKIVKGRDRDQFSVIIKRVDDRFVYIADGDKRKVDRAKRKNMNHLKLIDHISPEVRHSFEETGKVTNGKLRFALKKFLEEHADLLKEGE",
   "rna_sequence": "GGCCAGUCUGGCGUUUGGUGACAGCGCCAAGUUCUUCGGAAUUGGGAAAUCCUACUGGCC"
  },
  "construct_checks": {
   "reference_entity_poly_records": 2,
   "reference_sequence_column": "pdbx_seq_one_letter_code",
   "protein_construct_equals_a_reference_entity_sequence": true,
   "rna_construct_equals_a_reference_entity_sequence": false,
   "protein_positions_differing_from_same_length_entity": [],
   "rna_positions_differing_from_same_length_entity": [
    {
     "position": 1,
     "construct": "G",
     "reference": "X"
    }
   ],
   "note": "construct positions are read as the reference's label_seq_id; they mean the same thing as the prediction's residue numbers only when the prediction was made from the reference entity sequence. A False here is reported, not corrected; the frozen correspondence then counts any letter disagreements (dockq.correspondence and the adapter log).",
   "construct_positions_with_X": {
    "protein": [],
    "rna": []
   }
  }
 },
 "dockq": {
  "configuration": "RNPBENCH_SCORING_V3_CONSTRUCT_POSITION_DOCKQ_2_1_3",
  "status": "SCORED",
  "dockq": 0.936,
  "dockq_unrounded": 0.9358969555710455,
  "dockq_class": "high",
  "reported_statistic": "first interface in DockQ's own iteration order, rounded to 3 decimals (the frozen convention)",
  "selected_mapping": "AB:AB",
  "n_admissible_candidates": 1,
  "n_interfaces": 1,
  "adapter_total_dockq": 0.9358969555710455,
  "correspondence": {
   "in_frame": 148,
   "out_of_frame": 0,
   "indeterminate": 0,
   "n_pairs": 148
  },
  "per_interface": {
   "AB": {
    "DockQ": 0.9358969555710455,
    "fnat": 0.926829268292683,
    "fnonnat": 0.13636363636363635,
    "nat_correct": 38,
    "nat_total": 41,
    "model_total": 44,
    "len1": 89,
    "len2": 59,
    "iRMSD": 0.4336348127939377,
    "LRMSD": 1.780005001869165
   }
  },
  "failure_stage": null,
  "failure_reason": null,
  "failure_detail": null,
  "outcomes_seen": null,
  "candidate_outcomes": [
   {
    "mapping": "AB:AB",
    "outcome": "SCORED",
    "total_dockq": 0.9358969555710455,
    "exception": null
   }
  ],
  "model_numbering": {
   "A": {
    "n": 98,
    "contiguous_from_one": true,
    "length_equals_a_construct_length": true,
    "insertion_codes": 0,
    "usable_as_construct_positions": true
   },
   "B": {
    "n": 60,
    "contiguous_from_one": true,
    "length_equals_a_construct_length": true,
    "insertion_codes": 0,
    "usable_as_construct_positions": true
   }
  },
  "tolerance": 0
 },
 "geometry": {
  "status": "COMPUTED",
  "prot_internal_ca_rmsd": 0.5181605307153019,
  "n_prot_aligned": 89,
  "n_prot_pose": 98,
  "n_prot_native": 89,
  "rna_internal_c4_rmsd": 0.7509466812576658,
  "n_rna_aligned": 59,
  "n_rna_pose": 60,
  "n_rna_native": 59,
  "rna_placement_c4_rmsd": 1.7895059154434207,
  "chains_used": {
   "prediction": [
    "A",
    "B"
   ],
   "reference": [
    "A",
    "B"
   ]
  },
  "configuration": "RNPBENCH_FOUR_AXIS_DECOMPOSITION_SCORE_DECOMP_V1",
  "correspondence_note": "contacting protein-RNA chain pair chosen by the project's rule; residue correspondence by sequence alignment, not construct positions; a different route from the DockQ correspondence"
 },
 "validity": {
  "prediction_residues_vs_construct": {
   "A": {
    "kind": "protein",
    "residues": 98,
    "letters_equal_to_construct": 98,
    "numbered_outside_construct": 0,
    "first_differences": []
   },
   "B": {
    "kind": "rna",
    "residues": 60,
    "letters_equal_to_construct": 60,
    "numbered_outside_construct": 0,
    "first_differences": []
   }
  },
  "prediction_chain_kinds": [
   "prot",
   "rna"
  ],
  "prediction_has_protein_chain": true,
  "prediction_has_rna_chain": true,
  "model_numbering_usable_as_construct_positions": {
   "A": true,
   "B": true
  },
  "evaluable_dockq": true,
  "evaluable_geometry": true
 },
 "provenance": {
  "software_versions": {
   "python": "3.11.17",
   "platform": "Linux-7.0.0-34-generic-x86_64-with-glibc2.43",
   "DockQ": "2.1.3",
   "gemmi": "0.6.5",
   "biopython": "1.84",
   "numpy": "1.26.4",
   "scipy": "1.13.1"
  },
  "frozen_sources": {
   "canonical/pos_adapter.py": "579534631bb6398a22ca3ac24297298ba8a4af29619f7ff9c9df986dcf7bcf19",
   "canonical/corr_mask_audit.py": "390214d03b964928440cd16f488c270f4ded4797c5bec0e31da231d7746e643e",
   "canonical/rnpbench_score_v2.py": "0871f1f086575b05f9dd8714327493edb41851fee70ef63a70a8fd3190c0a032",
   "canonical/rf2na_scoring.py": "95348a815a0dab1f58482666a81d28be6442c9918b57779381e741f3340d2ada",
   "f1/f1_featurize_mp.py": "b4335e551a5bc771b41bc754f020b464673a006bfd15bf38af364c2451bab541",
   "f1/f1_b1c_allatom.py": "d9a15b311750c40ca3609169018ab1ac866ece6cb203496d2545829c6bf8bc18",
   "f1/f1_b2a_matrix.py": "f468c2c45972f221580584ee795b317025702bd3a87fa7e0935a36ca1c442c37",
   "decomp/score_decomp.py": "17d2976e9770f81d60369b172bff8d5a16dcfe63a676a9f7c8f47f07db18fb6b"
  },
  "frozen_origin": "copied byte-for-byte from the RNPBench development host on 2026-10-10; every SHA-256 below was checked against the original file on that host",
  "frozen_execution_record": "rnplens evaluate provenance --full prints every executed top-level statement and its hash"
 }
}